name,txt,ph_seq,ph_dur,ph_num,note_seq,note_dur,comments
000001,In the failing light of the afternoon,SP i n ð a f e ʎ i ŋ ɡ l aj t ɒ v ð a a f t a n uː n SP,0.48 0.13 0.23 0.05 0.06 0.11 0.29 0.07 0.11 0.01 0.04 0.11 0.73 0.03 0.25 0.04 0.05 0.21 0.57 0.07 0.06 0.61 0.13 0.93 0.43 0.45,1 2 2 6 3 2 2 7 1,rest B3 B3 A3 G#3 E3 E3 F#3 G#3 A3 B3 B3 rest,0.545669 0.325079 0.19737 0.325079 0.278639 0.777868 0.348299 0.16254 0.743039 0.731429 1.184218 0.18576 0.441179,
000002,Lucy in the shade of the dogwood blooms,SP l uː s i i n ð a ʃ e d ɒ v ð a d ɒ ɡ w ʊ d SP b l uː m z SP,0.43 0.1 0.19 0.13 0.22 0.03 0.03 0.03 0.28 0.18 0.76 0.1 0.25 0.05 0.04 0.06 0.12 0.62 0.03 0.08 0.02 0.6 0.03 0.03 0.07 0.71 0.53 0.1 0.18,1 4 2 2 3 2 2 6 1 5 1,rest B2 A#3 B3 A3 G#3 E3 E3 F#3 G#3 A3 B3 rest,0.522449 0.10449 0.2322 0.2322 0.25542 0.278639 0.835918 0.359909 0.18576 0.743039 0.731429 1.149388 0.371519,
000003,Yesterday the solace of a poison fish,SP j ɛ s t a dʲ e ð a s ɒ ʎ ɪ s ɒ v SP a SP p ɔj z ə n fʲ i ʃ SP,0.47 0.12 0.2 0.1 0.06 0.13 0.08 0.24 0.05 0.08 0.16 0.25 0.06 0.38 0.16 0.44 0.06 0.03 1.39 0.1 0.03 0.06 0.03 0.26 0.24 0.03 0.07 0.28 0.36,1 7 2 5 2 1 1 1 5 3 1,rest A#3 B3 A3 G#3 F#3 E3 E3 F#3 G#3 G#3 A3 B3 B3 rest,0.580499 0.371519 0.20898 0.290249 0.24381 0.336689 0.510839 0.348299 0.19737 0.464399 0.301859 0.743039 0.568889 0.10449 0.650159,
000004,Tomorrow I'll be kissing on her blood-red lips,SP ʈ ə m ɒ ɹ oː a ɫ bʲ i c ɪ s ɪ ŋ a n a b l ɐ d ɹ ɛ d ʎ i p s SP,0.48 0.06 0.04 0.11 0.18 0.05 0.29 0.19 0.08 0.07 0.11 0.14 0.43 0.16 0.05 0.22 0.24 0.07 0.15 0.07 0.07 0.56 0.03 0.09 1.2 0.14 0.03 0.03 0.14 0.18 0.42,1 6 2 2 5 2 1 4 3 4 1,rest B3 B3 G#3 F#3 E3 E3 F#3 G#3 A3 B3 rest,0.568889 0.313469 0.417959 0.278639 0.812698 0.25542 0.313469 0.2322 0.708209 0.766259 0.650159 0.766259,
000005,And no one is the savior they would like to be,SP a n n əw ʋ ɒ n i z ð a s e vʲ ɔ ð e a d l aj k SP ə SP bʲ i SP,0.58 0.07 0.1 0.04 0.19 0.03 0.22 0.09 0.24 0.07 0.03 0.09 0.13 0.7 0.03 0.03 0.14 0.23 0.18 0.03 0.1 0.59 0.08 0.03 0.61 0.03 0.09 0.85 0.48,1 2 2 3 2 2 4 2 2 3 1 1 1 2 1,rest B3 B3 A3 G#3 F#3 E3 E3 F#3 G#3 A3 B3 rest,0.801088 0.20898 0.313469 0.325079 0.2322 0.684989 0.20898 0.348299 0.18576 0.743039 0.696599 0.928798 0.406349,
000006,The love song of the buzzard in the dogwood tree,SP ð a l ɐ v s ɑ ŋ ɒ v ð a b ɐ z ə d i n ð a d ɒ ɡ w ʊ d SP t ɹ iː SP,0.48 0.05 0.03 0.07 0.18 0.04 0.16 0.16 0.07 0.18 0.08 0.04 0.13 0.07 0.81 0.03 0.03 0.03 0.22 0.06 0.03 0.08 0.12 0.63 0.04 0.05 0.02 0.61 0.03 0.09 0.14 0.93 0.44,1 2 3 3 2 2 5 2 2 6 1 3 1,rest B3 B3 A3 G#3 F#3 E3 E3 F#3 G#3 A3 B3 rest,0.638549 0.371519 0.22059 0.290249 0.2322 0.290249 0.603719 0.301859 0.19737 0.731429 0.743039 1.033288 0.476009,
000007,With a train of horses laughing through the traffic line,SP ʋ ɪ d̪ a t ɹ e n ɒ v h ɒ ɹ s ɪ z l a fʲ i ŋ ɡ t̪ ɹ ə f ð a t ɹ a fʲ i k l aj n SP,0.45 0.1 0.04 0.1 0.05 0.15 0.05 0.28 0.03 0.11 0.03 0.03 0.19 0.09 0.06 0.15 0.04 0.09 0.4 0.11 0.23 0.01 0.03 0.03 0.03 0.23 0.03 0.04 0.07 0.11 0.05 1.25 0.03 0.03 0.03 0.08 0.73 0.28 0.49,1 3 1 4 2 6 6 4 2 6 3 1,rest A2 A3 B3 A3 G#3 G3 F#3 E3 E3 F#3 G#3 A3 B3 rest,0.522449 0.383129 0.12771 0.394739 0.336689 0.267029 0.17415 0.348299 0.290249 0.336689 0.18576 0.754649 0.696599 1.068118 0.441179,
000008,And the cradle's unimaginative sense of time,SP a n ð a c ɹ e d ʊ ɫ z ɐ n i m a dʒ i n a tʲ i v s ɛ n s ɒ v ʈ aj m SP,0.62 0.08 0.08 0.03 0.03 0.14 0.07 0.27 0.03 0.12 0.03 0.05 0.26 0.05 0.1 0.09 0.57 0.13 0.39 0.03 0.03 0.08 0.2 0.05 0.12 0.41 0.09 0.06 0.58 0.06 0.09 0.87 1.23 0.19,1 2 2 7 12 4 2 3 1,rest rest A3 B3 B3 A3 G#3 F#3 G#3 F#3 E3 E3 F#3 G#3 A3 A3 F#3 F#3 rest,0.812698 0.18576 0.12771 0.2322 0.22059 0.290249 0.18576 0.10449 0.10449 0.487619 0.22059 0.325079 0.371519 0.545669 0.731429 0.359909 1.590567 0.19737 0.12771,
000009,[vocalizing],,,,,,
000010,[vocalizing],,,,,,
000011,Springtime and the promise of an open fist,SP s p ɹ ɪ ŋ ʈ aj m a n ð a p ɹ ɑ mʲ ɪ s ɒ v a n əw p ə n fʲ i s t SP,0.46 0.1 0.08 0.04 0.15 0.12 0.04 0.19 0.03 0.22 0.05 0.04 0.09 0.1 0.05 0.22 0.12 0.41 0.11 1.17 0.1 0.44 0.11 0.03 0.12 0.44 0.22 0.03 0.03 0.05 0.03 0.55,1 8 2 2 6 2 2 4 4 1,rest B3 B3 A3 G#3 F#3 E3 E3 F#3 G#3 A3 B3 rest,0.661769 0.336689 0.22059 0.290249 0.22059 0.348299 0.545669 0.336689 0.22059 0.708209 0.719819 0.603719 0.731429,
000012,A tattoo of a flower on a broken wrist,SP a ʈ a ʈ ʉː ɒ v SP a SP f l aw a a n a b ɹ əw k ə n ɹ i s t SP,0.58 0.07 0.13 0.17 0.12 0.19 0.46 0.06 0.04 2.09 0.03 0.03 0.03 0.52 0.03 0.73 0.03 0.03 0.03 0.03 0.03 0.03 0.03 0.03 0.03 0.03 0.07 0.03 0.62,1 1 4 2 1 1 1 4 2 1 6 4 1,rest A2 A3 B3 A3 G#3 F#3 E3 E3 F#3 G#3 A3 B3 rest,0.615329 0.16254 0.290249 0.25542 0.290249 0.2322 0.359909 0.545669 0.325079 0.17415 0.731429 0.731429 0.847528 0.743039,
000013,And Lucy tells me jokingly to wipe her brow,SP a n l uː s i ʈ ɛ l z ɛ mʲ iː dʒ əw c ɪ ɲ ʎ i SP ə SP ʋ aj p SP a SP b ɹ aw SP,0.63 0.08 0.13 0.05 0.13 0.13 0.19 0.09 0.18 0.05 0.06 0.03 0.03 0.11 0.11 0.36 0.15 0.13 0.16 0.03 0.24 0.03 0.81 0.03 0.03 0.05 0.03 0.03 0.65 0.03 0.05 0.04 1.4 0.47,1 2 4 4 3 7 1 1 1 3 1 1 1 3 1,rest B2 B3 B3 A3 G#3 F#3 E3 E3 F#3 G#3 A3 B3 B3,0.673379 0.22059 0.25542 0.278639 0.325079 0.24381 0.522449 0.301859 0.301859 0.24381 0.743039 0.708209 1.358367 0.545669,
000014,With a pocket map to heaven and the sun goes down,SP ʋ ɪ d̪ a p ɒ c ɪ ʈ m a p ə h ɛ v ə n a n ð a s ɐ n ɡ əw z d aw n SP,0.47 0.07 0.07 0.06 0.07 0.11 0.2 0.1 0.18 0.03 0.07 0.18 0.11 0.14 0.13 0.18 0.09 0.41 0.14 0.23 0.07 0.04 0.05 0.15 0.49 0.22 0.06 0.5 0.12 0.05 0.88 0.44 0.47,1 3 1 5 3 1 5 2 2 3 3 3 1,rest A#2 D3 A3 B3 A3 G#3 G#3 F#3 E3 E3 F#3 G#3 A3 B3 rest,0.534059 0.12771 0.20898 0.290249 0.267029 0.301859 0.16254 0.1161 0.336689 0.464399 0.325079 0.2322 0.743039 0.673379 1.323537 0.476009,
000015,[vocalizing],,,,,,
000016,[vocalizing],,,,,,
000017,Love was a promise made of smoke in a frozen copse of trees,SP l ɐ v ʋ ɒ z a p ɹ ɑ mʲ ɪ s m e d ɒ v s m əw k SP i n a f ɹ əw z ə n k ɒ p s ɒ v t ɹ iː z SP,0.5 0.08 1.22 0.03 0.03 0.03 0.06 0.14 0.11 0.04 0.19 0.06 0.19 0.08 0.1 0.23 0.03 0.1 0.03 0.15 0.07 0.37 0.04 0.53 0.07 0.03 0.22 0.13 0.04 0.74 0.07 0.25 0.06 0.1 0.22 0.07 0.1 0.08 0.05 0.07 0.1 2.13 0.3 0.35,1 3 3 1 6 3 2 4 1 2 1 6 4 2 4 1,rest F#3 A3 A3 G3 A3 G3 A3 G3 G3 G3 A3 rest G3 G3 A3 G3 G3 G3 A3 G3 G3 F3 rest,0.580499 0.16254 0.905578 0.301859 0.267029 0.290249 0.348299 0.25542 0.301859 0.05805 0.10449 0.325079 0.580499 0.383129 0.17415 0.325079 0.18576 0.18576 0.394739 0.383129 0.20898 0.406349 1.857596 0.603719,
000018,A bone cold and older than our bodies slowly floating in the sea,SP a b əw n k oː l ɖ a n əw ɫ d ə d̪ a n a b ɑ dʲ i z s l əw ʎ i f l əw tʲ ɪ ŋ i n ð a s iː SP,0.59 0.33 0.15 0.69 0.09 0.05 0.32 0.04 0.03 0.14 0.06 0.34 0.03 0.03 0.18 0.06 0.2 0.05 0.2 0.09 0.76 0.04 0.11 0.05 0.07 0.07 0.22 0.1 0.08 0.1 0.08 0.59 0.03 0.03 0.03 0.21 0.07 0.04 0.42 0.16 1.81 0.18,1 1 3 4 2 4 3 1 5 5 6 2 2 2 1,rest C#3 A3 A3 G3 A3 G3 G3 A3 G3 G3 A3 G3 A3 G3 G#3 A3 G3 G3 A3 G3 F#3 G3 F3 rest,0.638549 0.429569 0.835918 0.383129 0.19737 0.25542 0.15093 0.2322 0.267029 0.278639 0.313469 0.487619 0.24381 0.325079 0.24381 0.17415 0.24381 0.278639 0.371519 0.301859 0.278639 0.13932 0.278639 1.369977 0.20898,
000019,Every morning there were planes the shiny blades of pagan angels in our father's skies,SP ɛ ɹ i m ɒ ɹ ɲ ɪ ŋ ð ɚ ʋ ə p l e n z ð a ʃ aj ɲ i b l e d z ɒ v p ə ɡ ɑː n e n dʒ ɛ ɫ z i n a f a ð a z s c aj z SP,0.44 0.3 0.21 0.03 0.11 0.21 0.14 0.05 0.08 0.1 0.05 0.25 0.04 0.16 0.11 0.13 0.41 0.18 0.04 0.04 0.06 0.17 0.3 0.06 0.13 0.06 0.11 0.65 0.05 0.03 0.06 0.1 0.05 0.26 0.07 0.05 0.16 0.25 0.09 0.06 0.06 0.16 0.09 0.21 0.1 0.16 0.17 0.21 0.07 0.15 0.09 0.07 0.09 1.53 0.03 0.63,1 3 6 2 2 5 2 4 5 2 5 6 2 1 5 4 1,rest D#3 D3 D#3 D#3 D#3 D#3 D#3 D3 D#3 D#3 D3 D3 D#3 D#3 D#3 D3 D#3 D3 D#3 D3 D#3 G3 F3 G3 F3 rest,0.510839 0.359909 0.22059 0.394739 0.2322 0.290249 0.290249 0.766259 0.24381 0.348299 0.20898 0.10449 0.24381 0.487619 0.22059 0.313469 0.20898 0.406349 0.313469 0.290249 0.348299 0.267029 0.417959 0.1161 0.325079 1.300317 0.441179,
000020,Every evening I would watch her hold the pillow tight against her hollows her unholy child,SP ɛ ɹ i ɛ v ɛ ɲ i ŋ ɡ aj a d ʋ ɒ tʃ a h əw ɫ d ð a p ɪ l oː ʈ aj ʈ a ɡ ɛ i n s t a h ɒ l əw z a ɐ n h əw ʎ i tʃ aj ɫ d SP,0.48 0.17 0.38 0.31 0.04 0.03 0.03 0.06 0.17 0.01 0.03 0.19 0.23 0.03 0.1 0.21 0.12 0.25 0.12 0.09 0.18 0.03 0.05 0.08 0.15 0.16 0.09 0.36 0.14 0.37 0.03 0.11 0.09 0.16 0.03 0.03 0.04 0.1 0.18 0.09 0.2 0.06 0.24 0.1 0.31 0.15 0.07 0.11 0.24 0.13 0.45 0.17 1.01 0.03 0.03 0.46,1 3 7 1 2 3 1 4 2 4 3 7 1 5 1 6 4 1,rest D3 D3 D#3 D3 D3 D3 D3 D3 D#3 D3 D#3 D3 C#3 D#3 D3 D#3 D3 D#3 D3 D#3 D3 D#3 D3 C3 A2 rest,0.522449 0.383129 0.19737 0.394739 0.20898 0.301859 0.278639 0.301859 0.336689 0.383129 0.2322 0.22059 0.534059 0.15093 0.25542 0.19737 0.348299 0.25542 0.267029 0.383129 0.290249 0.301859 0.383129 0.615329 0.371519 0.789478 0.383129,
000021,I was still a beggar shaking out my stolen coat among the angry cemetery leaves,SP aj ʋ ɒ z s tʲ i ɫ a b ɛ ɡ a ʃ e c i ŋ ɡ aw t m ɑ s t əw l ə n k oː ʈ a m ɔ ŋ ɡ ð a a ɲ ɟ ɹ i s ɛ m a t ɹ i ʎ iː v z SP,0.47 0.33 0.05 0.11 0.04 0.07 0.09 0.18 0.25 0.03 0.13 0.24 0.05 0.11 0.18 0.22 0.08 0.27 0.01 0.03 0.23 0.03 0.1 0.13 0.14 0.09 0.23 0.07 0.08 0.15 0.11 0.41 0.03 0.06 0.16 0.16 0.13 0.03 0.03 0.25 0.12 0.14 0.03 0.07 0.09 0.18 0.16 0.07 0.07 0.13 0.33 0.12 0.14 3.28 0.18 0.13 0.42,1 1 3 4 1 4 6 2 2 6 3 5 2 5 7 4 1,rest D3 D3 D#3 D3 D#3 D3 D#3 D3 D#3 D3 D#3 D3 D#3 D3 D#3 D3 D#3 D3 D#3 D3 D#3 F3 F3 rest,0.522449 0.325079 0.313469 0.336689 0.267029 0.267029 0.290249 0.313469 0.301859 0.359909 0.359909 0.301859 0.348299 0.325079 0.325079 0.336689 0.2322 0.325079 0.348299 0.22059 0.22059 0.313469 0.267029 3.471383 0.534059,
000022,When they caught the king beneath the borrowed car righteous drunk and fumbling for the royal keys,SP ʋ ɛ n ð e k ɒː ʈ ð a c ɪ ŋ b ɛ ɲ iː θ ð a b ɒ ɹ əw d k ɑː ɹ aj tʃ ə s d ɹ ɐ ŋ k a n f ɐ m b ʎ ɪ ŋ f a ð a ɹ ɔj a ɫ SP c iː z SP,0.61 0.09 0.16 0.12 0.03 0.13 0.11 0.25 0.13 0.04 0.07 0.15 0.19 0.17 0.03 0.07 0.14 0.2 0.07 0.06 0.12 0.19 0.13 0.16 0.14 0.12 0.1 0.4 0.35 0.29 0.13 0.09 0.06 0.09 0.06 0.16 0.03 0.06 0.04 0.11 0.12 0.19 0.05 0.03 0.07 0.11 0.1 0.1 0.28 0.08 0.1 0.13 0.43 0.15 0.9 0.04 0.1 2.77 0.04 0.39,1 3 2 3 2 3 5 2 5 2 5 5 2 7 2 2 4 1 3 1,rest D#3 D3 D#3 D#3 D#3 D3 D#3 D3 D#3 D3 D3 D#3 D#3 D3 D#3 D3 D#3 D3 D#3 D3 D#3 D#3 F3 F3 F3,0.696599 0.301859 0.267029 0.394739 0.2322 0.383129 0.19737 0.325079 0.336689 0.267029 0.383129 0.17415 0.557279 0.429569 0.25542 0.301859 0.267029 0.278639 0.371519 0.348299 0.22059 0.371519 0.441179 0.835918 2.496145 0.696599,
000023,[vocalizing],,,,,,
000024,[vocalizing],,,,,,
000025,[vocalizing],,,,,,
000026,[vocalizing],,,,,,
000027,[vocalizing],,,,,,
000028,[vocalizing],,,,,,
000029,Love was a father's flag and sung like a shank in a cake on our leather boots,SP l ɐ v ʋ ɒ z SP a SP f a ð a z f l a ɡ a n s ɐ ŋ l aj k a SP ʃ a ŋ k i n a c eː k a n a l ɛ ð a b uː t s SP,0.05 0.04 0.2 0.03 0.03 0.03 0.03 0.03 1.35 0.08 0.03 0.23 0.07 0.14 0.04 0.07 0.08 0.21 0.05 0.15 0.1 0.03 0.51 0.04 0.2 0.19 0.04 0.69 0.03 0.27 0.6 0.03 0.05 0.14 0.03 0.03 0.17 0.03 0.03 0.14 0.08 0.03 0.03 0.11 0.09 0.03 0.03 1.38 0.03 0.03 0.15,1 3 3 1 1 1 5 4 2 3 3 1 1 4 2 1 3 2 1 4 4 1,rest C3 A3 A3 G3 A3 G3 A3 G3 G3 A3 G3 A3 G#3 A3 G3 G3 A3 G3 A3 G3 A3 G3 G3 F3 rest,0.08127 0.383129 0.824308 0.313469 0.290249 0.301859 0.267029 0.325079 0.278639 0.18576 0.394739 0.18576 0.22059 0.20898 0.16254 0.22059 0.394739 0.24381 0.18576 0.267029 0.359909 0.290249 0.325079 0.301859 1.137778 0.13932,
000030,A beautiful feather floating down to where the birds had shit on empty chapel pews,SP a SP bʲ ʉː tʲ ɪ f ə ɫ f ɛ ð a f l əw tʲ ɪ ŋ d aw n ə ʋ ɛː ð a b aː d z h a d ʃ i t a n ɛ m p tʰ i tʃ a p ə l pʲ uː z SP,0.47 0.91 0.03 0.03 0.03 0.03 0.03 0.03 0.08 0.03 0.03 0.15 0.03 0.03 0.03 0.03 1.15 0.19 0.07 0.43 0.04 0.1 0.12 1.19 0.03 0.23 0.03 0.03 0.03 0.16 0.06 0.03 0.05 0.2 0.06 0.1 0.15 0.06 0.14 0.03 0.03 0.03 0.05 0.04 0.03 0.01 1.57 0.03 0.85 0.03 0.03 0.06 0.08 0.34,1 1 1 7 4 6 3 1 2 2 4 3 3 2 5 5 3 1,rest D#3 D3 D#3 D3 D#3 D3 D#3 D#3 D3 D#3 D3 D3 D#3 D3 D#3 D3 D#3 D3 D#3 D#3 D#3 G3 G3 G3 F3 rest,0.499229 0.371519 0.2322 0.371519 0.2322 0.290249 0.301859 0.371519 0.394739 0.25542 0.301859 0.2322 0.20898 0.313469 0.348299 0.2322 0.336689 0.313469 0.290249 0.371519 0.20898 0.325079 0.267029 0.12771 0.487619 1.706667 0.429569,
000031,Every evening she'd descend the mountain stealing socks and singing something good where all the horses fell,SP ɛ ɹ i ɛ v ɛ ɲ i ŋ ɡ ʃ iː d d ɛ s ɛ n d ð a m aw n t ə n s tʲ iː ʎ ɪ ŋ s ɑ k s a n s ɪ ɲ ɪ ŋ s ɐ m p m̩ ɡ ʊ d ʋ ɛː ɑː ɫ ð a SP h ɒ ɹ s ɪ z f ɛ l SP,0.49 0.22 0.23 0.43 0.03 0.03 0.03 0.04 0.1 0.01 0.03 0.12 0.21 0.06 0.03 0.07 0.18 0.21 0.09 0.03 0.03 0.11 0.19 0.2 0.07 0.05 0.07 0.09 0.16 0.1 0.17 0.08 0.07 0.08 0.19 0.23 0.09 0.12 0.05 0.08 0.11 0.04 0.03 0.1 0.2 0.15 0.16 0.06 0.03 0.18 0.03 0.32 0.03 0.06 0.21 0.21 0.06 0.04 0.37 0.03 0.03 0.03 0.04 0.13 0.16 0.11 0.08 0.7 0.3 0.45,1 3 7 3 6 2 6 6 4 2 5 5 3 2 2 2 1 6 3 1,rest D#3 D3 D#3 D3 D#3 D3 D#3 D3 D#3 D3 D#3 D3 D#3 D#3 D#3 D3 D#3 D3 D3 D#3 D3 D3 D#3 D#3 C3 A2 A2 rest,0.534059 0.336689 0.2322 0.394739 0.267029 0.301859 0.24381 0.336689 0.313469 0.348299 0.417959 0.18576 0.394739 0.429569 0.25542 0.19737 0.325079 0.2322 0.22059 0.12771 0.278639 0.499229 0.301859 0.348299 0.371519 0.348299 0.16254 0.441179 0.476009,
000032,Like a snake within the wilted garden wall I'd hint to her every possibility,SP l aj k a s n e k ʋ ɪ d̪ ɪ n ð a ʋ ɪ l ʈʲ ɪ ɖ ɡ a d ɛ n ʋ ɒː l aj d ç i n t ə a ɛ ɹ i p ɒ s ɪ bʲ ɪ ʎ i ʈʲ i SP,0.48 0.04 0.25 0.1 0.08 0.14 0.08 0.2 0.07 0.05 0.17 0.06 0.16 0.19 0.04 0.13 0.08 0.13 0.15 0.08 0.16 0.08 0.04 0.32 0.03 0.09 0.06 0.03 0.03 0.03 0.64 0.03 0.09 0.21 0.1 0.11 0.97 0.04 0.03 0.03 0.04 0.12 0.22 0.17 0.1 0.13 0.13 0.1 0.08 0.13 1.54 0.45,1 3 1 4 5 2 6 5 3 2 4 1 1 3 10 1,rest D3 D3 D#3 D3 D#3 D3 D#3 D#3 D#3 D3 D#3 D3 D3 D#3 D3 D#3 D#3 D#3 D3 D#3 F3 F3 rest,0.534059 0.336689 0.2322 0.359909 0.25542 0.371519 0.24381 0.348299 0.278639 0.348299 0.17415 0.336689 0.417959 0.10449 0.394739 0.278639 0.673379 0.278639 0.383129 0.24381 0.19737 0.2322 1.555737 0.429569,
000033,While with his gun the pagan angel rose to say My love is one made to break every bended knee [vocalizing],SP ʋ aj l ʋ ɪ d̪ ç i z ɡ ɐ n ð a p ə ɡ ɑː n e n dʒ ɛ ɫ ɹ əw z ə s e m ɑ l ɐ v i z ʋ ɒ n m e d ə b ɹ e k ɛ ɹ i b ɛ n d ɛ d ɲ i SP,0.66 0.13 0.24 0.07 0.05 0.18 0.03 0.03 0.11 0.09 0.03 0.25 0.12 0.05 0.07 0.04 0.03 0.06 0.03 0.03 0.72 0.11 0.05 0.09 0.09 0.13 0.21 0.15 0.07 0.19 0.24 0.08 0.13 0.1 0.37 0.04 0.11 0.05 0.05 0.19 0.15 0.03 0.28 0.09 0.1 0.09 0.08 0.26 0.12 0.2 0.28 0.03 0.08 0.18 0.13 0.04 1.01 0.03 0.19 3.45 4.09,1 3 3 3 3 2 5 5 3 1 2 2 3 2 3 3 1 4 3 6 2 1,rest B2 D#3 D3 D#3 D3 D#3 D3 D#3 D3 D#3 D3 D#3 D3 D3 D#3 D#3 D#3 D#3 D3 D#3 D#3 D3 D#3 D#3 F3 F3 rest A#3 C4 C4,0.824308 0.325079 0.24381 0.2322 0.359909 0.267029 0.348299 0.19737 0.394739 0.290249 0.371519 0.25542 0.313469 0.24381 0.16254 0.24381 0.20898 0.371519 0.359909 0.22059 0.452789 0.371519 0.20898 0.348299 0.441179 0.789478 3.482993 0.464399 1.219048 0.19737 2.171066,"exclude:mixed_vocalizing,SNR=2.3,dev=9.8"
000034,[Vocalizing],,,,,,
000035,In our days we will live like our ghosts will live,SP i n SP a d e z ʋ iː ʋ ɪ l l aj v SP l aj k SP a SP ɡ əw s t s ʋ ɪ l l aj v SP,0.47 0.4 2.37 0.43 0.12 0.03 0.42 0.03 0.03 0.43 0.03 0.03 0.15 0.03 0.39 0.07 1.12 0.06 0.33 0.12 0.03 0.63 0.03 0.14 0.5 0.04 0.15 0.05 0.12 0.05 0.14 0.03 0.23 0.39 0.36,1 2 1 1 3 2 3 3 1 3 1 1 1 5 3 3 1,rest F#3 E3 E3 E3 rest F#3 E3 E3 E3 rest D#3 F#3 G#3 G#3 D#3 D#3,0.534059 0.429569 0.18576 0.917188 1.195828 0.487619 0.684989 0.975238 0.708209 0.09288 0.429569 0.441179 0.812698 0.429569 0.359909 0.325079 0.952018,"exclude:low_SNR=5.8,dev=5.6"
000036,Pitching glass at the cornfield crows and folding clothes,p ɪ tʃ ʈʲ ɪ ŋ ɡ l a s SP a t SP ð a SP k ɒː n fʲ i ɫ d k ɹ əw z SP a n f əw ɫ dʲ ɪ ŋ SP k l əw ð z SP,0.09 0.16 0.07 0.06 0.03 0.9 0.03 0.03 0.03 0.03 1.21 0.03 0.03 0.13 0.05 0.03 0.23 0.09 0.48 0.12 0.12 0.35 0.22 0.09 0.08 0.05 1.01 0.1 0.38 0.04 0.07 0.13 0.36 0.03 0.03 0.07 0.85 0.03 0.07 0.04 0.71 0.19 0.03 0.24,6 4 1 2 1 2 1 7 4 1 2 6 1 5 1,rest F#3 E3 E3 E3 rest E3 F#3 E3 E3 rest E3 E3 E3 F#3 D#3 rest,0.10449 0.278639 0.952018 1.509297 0.1161 0.278639 0.2322 0.487619 0.754649 1.079728 0.684989 0.18576 0.2322 0.25542 0.777868 0.952018 0.24381,"exclude:low_SNR=2.8,dev=5.0"
000037,Like stubborn boys across the road,SP l aj k s t ɐ b ə n b ɔj z SP a k ɹ ɔ s ð a ɹ əw d SP,0.49 0.2 0.21 0.04 0.19 0.07 0.31 0.11 0.36 0.42 0.03 1.16 0.09 0.45 0.03 0.05 0.05 0.26 0.11 0.07 0.1 0.1 0.73 0.26 0.3,1 3 6 3 1 5 2 3 1,rest B2 B2 D#3 F#3 E3 E3 rest F#3 F#3 D#3 E3 rest,0.534059 0.17415 0.510839 0.1161 0.290249 0.812698 1.242268 0.545669 0.13932 0.336689 0.25542 1.010068 0.22059,
000038,We'll keep everything,SP ʋ ə l c iː p ɛ ɹ i θ ɪ ŋ SP,0.48 0.05 0.29 0.05 0.11 0.68 0.1 0.68 0.26 0.08 0.18 0.39 0.7 0.45,1 3 3 6 1,rest E3 F#3 G#3 G#3 D#3 D#3 D#3 rest,0.592109 0.394739 0.789478 0.1161 0.278639 0.487619 0.301859 1.114558 0.429569,
000039,Grandma's gun and the black bear claw,SP ɡ ɹ a n m a z ɡ ɐ n a n ð a b l a k b ɛ ɹ k l ɒ SP,0.07 0.04 0.05 0.35 0.08 0.03 0.77 0.1 0.13 0.06 0.03 0.5 1.01 0.03 0.03 0.18 0.06 0.17 0.1 0.1 0.55 0.35 0.13 0.04 0.72 0.35,1 7 3 2 2 4 3 3 1,rest E3 F#3 E3 E3 C3 F#3 E3 E3 rest,0.12771 0.15093 0.325079 1.010068 1.428027 0.429569 0.429569 1.044898 0.882358 0.20898,
000040,That took her dog,SP æ t ʈ ʊ k a d ɑ ɡ SP,0.46 0.07 0.1 0.09 0.21 0.15 0.89 0.14 0.83 0.1 0.4,1 2 3 1 3 1,rest rest E3 E3 F#3 E3 D#3 rest,0.510839 0.20898 0.359909 0.348299 0.673379 0.267029 0.882358 0.19737,
000041,When sister Laurie says Amen We won't hear anything,SP ʋ ɛ n s i s t a l ɒ ɹ i s e z SP a m ɛ n SP ʋ iː ʋ oː n ʈ ç i a ɛ ɲ i fʲ ɪ ŋ SP,0.49 0.03 0.03 0.42 0.08 0.03 0.06 0.03 0.03 0.03 0.03 0.03 0.03 0.03 0.46 0.22 0.25 3.36 0.12 0.34 0.23 0.4 0.04 0.06 0.1 0.26 0.1 0.03 0.03 0.24 1.31 0.04 0.08 0.13 0.11 0.34 0.64 0.15,1 3 5 4 3 1 4 1 2 4 3 6 1,rest B2 E3 F#3 rest E3 E3 F#3 E3 E3 rest E3 F#3 F#3 G#3 D#3 D#3 D#3 rest,0.766259 0.417959 0.17415 0.499229 0.441179 0.359909 1.718277 0.371519 1.021678 0.534059 0.626939 0.406349 0.801088 0.15093 0.313469 0.417959 0.24381 0.963628 0.16254,
000042,The ten-car trains will take that word That fledgling bird,SP ð a SP ʈ ɛ n k ɑː SP t ɹ e n z SP ʋ ɪ l SP ʈ eː k æ t ʋ ɜː ɖ SP æ t f l ɛ dʒ ʎ ɪ ŋ b aː d SP,0.07 0.04 0.03 0.11 0.04 0.27 0.14 0.08 0.56 0.35 0.07 0.05 0.85 0.28 0.03 0.32 0.03 0.03 0.03 0.09 0.08 0.45 0.03 0.73 0.03 0.05 1.07 0.12 0.3 0.06 0.21 0.11 0.08 0.17 0.14 0.06 0.71 0.23 0.05 0.86 0.04 0.92,1 2 1 3 2 1 5 1 3 1 3 2 3 1 2 7 3 1,rest F#3 E3 E3 rest E3 F#3 E3 rest D#2 E3 E3 F#3 E3 D#3 rest,0.301859 0.487619 0.986848 1.184218 0.603719 0.17415 0.325079 1.938866 0.371519 0.406349 0.313469 0.325079 0.719819 0.25542 1.149388 0.417959,"exclude:low_SNR=6.8,dev=3.9"
000043,And the fallen house across the way,SP a n ð a f ɒ l ə n h aw s a k ɹ ɔ s ð a ʋ eː SP,0.49 0.08 0.13 0.04 0.03 0.18 0.75 0.04 0.43 0.06 0.17 1.38 0.15 0.05 0.17 0.06 0.18 0.13 0.05 0.15 0.14 0.92 0.16,1 2 2 5 3 5 2 2 1,rest A#2 A#2 D#3 F#3 E3 E3 E3 B2 F#3 E3 E3 rest,0.534059 0.16254 0.25542 0.20898 0.24381 0.452789 0.383129 1.695057 0.2322 0.394739 0.313469 0.928798 0.13932,
000044,It'll keep everything,SP ɪ t ə ɫ c iː p ɛ ɹ i θ ɪ ŋ SP,0.48 0.24 0.03 0.08 0.03 0.13 0.64 0.11 0.65 0.3 0.04 0.14 0.36 0.85 0.42,1 4 3 6 1,rest E3 F#3 G#3 G#3 D#3 D#3 D#3 rest,0.545669 0.452789 0.754649 0.10449 0.278639 0.452789 0.25542 1.265488 0.394739,
000045,The baby's breath Our bravery wasted and our shame,SP ð a b e bʲ i z b ɹ ɛ t̪ SP a SP b ɹ e v ɛ ɹ i ʋ eː s ʈʲ ɪ ɖ a n SP a SP ʃ e m SP,0.49 0.11 0.03 0.13 0.37 0.08 0.76 0.09 0.11 0.07 0.16 0.03 0.03 1.38 0.05 0.04 0.13 0.22 0.08 0.06 0.23 0.54 0.23 1.29 0.21 0.06 0.13 0.05 0.28 0.09 0.03 0.76 0.03 0.19 0.6 0.28 0.37,1 2 5 4 1 1 1 7 6 2 1 1 1 3 1,rest G#2 F#3 E3 E3 B2 F#3 E3 E3 E3 E3 E3 E3 F#3 E3 D#3 rest,0.545669 0.2322 0.429569 0.975238 1.393197 0.371519 0.429569 0.24381 0.777868 1.625397 0.15093 0.359909 0.301859 0.719819 0.290249 0.684989 0.25542,
000046,And we'll undress beside the ashes of the fire,SP a n ʋ ə l ɐ n d ɹ ɛ s b ə s aj d ð a a ʃ ɛ z ɒ v ð a f aj a SP,0.62 0.03 0.3 0.06 0.09 0.06 0.61 0.15 0.05 0.05 0.22 0.16 0.09 0.1 0.12 0.97 0.03 0.03 0.03 0.26 0.13 0.17 0.07 0.26 0.06 0.05 0.11 0.14 0.78 0.12 0.44,1 2 3 6 5 2 4 2 2 3 1,rest G#2 B3 B3 B3 A3 A3 G#3 G#3 A3 G#3 A3 B3 G#3 rest,0.510839 0.522449 0.452789 0.452789 0.545669 0.2322 0.406349 0.17415 0.429569 0.429569 0.267029 0.325079 0.267029 0.870748 0.476009,
000047,Both our tender bellies wound in baling wire,SP b əw θ a ʈ ɛ n ɖ ə b ɛ ʎ i z ʋ aw n ɖ i n b e ʎ ɪ ŋ ʋ aj ə SP,0.34 0.03 0.03 0.03 0.03 0.14 0.23 0.08 0.04 0.16 0.12 0.34 0.09 0.34 0.05 0.03 1.55 0.04 0.03 0.05 0.13 0.04 0.33 0.07 0.09 0.04 0.08 0.83 0.49 0.48,1 3 1 5 5 4 2 5 3 1,rest G#3 B3 B3 B3 A3 G#3 G#3 A3 G#3 A3 G#3 G#3 G#3 G#3 G#3 F#3 rest,0.615329 0.325079 0.290249 0.1161 0.325079 0.394739 0.25542 0.1161 0.25542 0.24381 0.359909 0.383129 0.24381 0.371519 0.19737 0.487619 0.940408 0.406349,
000048,All the more a pair of underwater pearls,SP ɑː ɫ ð a m ɒː a p ɛː ɒ v SP ɐ n d ə w ɒː t ə p ɜː l z SP,0.6 0.4 0.05 0.09 0.1 0.12 0.64 0.29 0.13 0.49 0.06 0.04 0.04 0.71 0.09 0.04 0.16 0.05 0.33 0.06 0.16 0.12 1.24 0.74 0.04 0.21,1 2 2 2 1 2 2 1 8 4 1,rest F#3 G#3 B3 B3 A3 A3 G#3 G#3 A3 G#3 G#3 A3 B3 G#3 F#3 E3 rest,0.650159 0.20898 0.267029 0.2322 0.777868 0.290249 0.406349 0.2322 0.12771 0.278639 0.417959 0.267029 0.336689 0.290249 0.708209 0.18576 1.102948 0.22059,
000049,Than the oak tree and its resurrection fern,SP d̪ a n ð a əw k t ɹ iː SP a n i t s SP ɹ ɛ z ə ɹ ɛ c ʃ ə n SP f aː n SP,0.52 0.05 0.28 0.11 0.03 0.27 0.49 0.09 0.09 0.1 0.54 0.09 0.03 0.43 0.03 0.04 0.1 0.04 0.12 0.21 0.09 0.16 0.13 0.25 0.04 0.15 0.68 0.13 0.5 0.05 4.68 1.01 0.49,1 3 2 2 3 1 2 3 1 10 1 3 1,rest G3 E3 E3 F#3 E3 E3 D#3 E3 D#3 E3 F#3 G#3 rest G#3 F#3 E3 rest,0.568889 0.429569 0.22059 0.25542 0.476009 0.522449 0.313469 0.650159 0.325079 0.290249 0.441179 0.313469 0.510839 0.522449 0.487619 3.018594 2.240726 0.441179,
000050,In our days we will say What our ghosts will say,SP i n SP a SP d e z ʋ iː ʋ ɪ l s e SP ʋ ɒ ʈ a ɡ əw s t s ʋ ɪ l s e SP,0.72 0.49 0.16 0.03 0.66 0.03 0.1 1.47 0.08 0.1 0.41 0.03 0.5 0.31 0.28 0.78 0.39 0.05 0.03 0.03 1.01 0.17 0.49 0.04 0.09 0.03 0.12 0.05 0.13 0.2 1.73 0.46,1 2 1 1 1 3 2 3 2 1 3 1 5 3 2 1,rest E3 F#3 E3 E3 F#3 E3 E3 E3 rest E3 F#3 G#3 D#3 D#3 E3 D#3 rest,0.777868 0.22059 0.394739 0.801088 1.660227 0.464399 0.24381 0.812698 0.789478 0.441179 0.417959 0.801088 0.325079 0.359909 0.476009 0.417959 1.346757 0.417959,
000051,We gave the world what it saw fit,SP ʋ iː ɡ e v ð a ʋ ɜː l ɖ ʋ ɒ ʈ i t s ɒ fʲ i t SP,0.66 0.05 0.08 0.13 0.33 0.05 0.05 0.03 0.03 2.15 0.12 0.03 0.12 0.2 0.05 0.23 0.05 0.19 0.7 0.24 0.11 0.03 0.74,1 2 3 2 4 3 2 2 3 1,rest F#3 E3 A2 B2 F#3 E3 E3 rest,0.940408 0.394739 2.380045 0.12771 0.267029 0.417959 0.975238 0.371519 0.487619,
000052,And what'd we get?,SP a n ʋ ə ɖ ʋ iː ɡ ɛ t SP,0.71 0.05 0.11 0.06 0.22 0.03 0.11 0.89 0.11 0.63 0.03 0.68,1 2 3 2 3 1,rest E3 E3 F#3 E3 D#3 D#3 rest,0.917188 0.394739 0.24381 0.743039 0.20898 0.650159 0.1161 0.359909,
000053,Like stubborn boys with big green eyes We'll see everything,SP l aj k s t ɐ b ə n b ɔj z ʋ ɪ d̪ bʲ i ɡ ɟ ɹ i n aj z SP ʋ ə l s iː ɛ ɹ i θ ɪ ŋ SP,0.66 0.13 0.17 0.05 0.16 0.08 0.33 0.1 0.47 0.26 0.04 1.42 0.07 0.1 0.04 0.06 0.12 0.19 0.09 0.03 0.28 0.72 0.06 0.69 0.1 0.35 0.05 0.18 0.07 0.22 0.67 0.56 0.47 0.04 0.14 0.36 1.11 0.51,1 3 6 3 3 3 4 2 1 3 2 6 1,rest A#2 E3 F#3 E3 E3 A#2 F#3 E3 E3 E3 rest E3 F#3 G#3 D#3 D#3 E3 D#3 rest,0.696599 0.568889 0.13932 0.278639 0.766259 1.497687 0.313469 0.325079 0.25542 0.789478 0.777868 0.464399 0.406349 0.777868 0.313469 0.487619 0.348299 0.20898 1.253878 0.476009,
000054,In the timid shade of the autumn leaves And the buzzard's wing,SP i n ð a ʈ ɪ mʲ ɪ ɖ ʃ e d ɒ v ð a ɒ t ə m ʎ iː v z SP a n ð a b ɐ z ə d z ʋ ɪ ŋ SP,0.45 0.04 0.12 0.06 0.04 0.19 0.22 0.08 0.88 0.04 0.23 1.27 0.08 0.03 0.12 0.03 0.29 0.69 0.09 0.31 0.24 0.04 0.85 0.08 0.11 0.28 0.04 0.1 0.04 0.05 0.17 1.18 0.09 0.11 0.03 0.03 0.03 0.37 1.19 0.3,1 2 2 5 3 2 2 4 4 1 2 2 6 3 1,rest B2 F#3 E3 E3 A#2 B2 E3 F#3 E3 E3 E3 rest G2 E3 E3 F#3 E3 E3 D#3 D#3 rest,0.638549 0.278639 0.301859 1.126168 1.346757 0.18576 0.24381 0.18576 0.2322 0.417959 0.592109 1.010068 0.464399 0.24381 0.25542 0.313469 0.696599 0.20898 0.20898 1.149388 0.22059 0.267029,
000055,And we'll undress beside the ashes of the fire,SP a n ʋ ə l ɐ n d ɹ ɛ s b ə s aj d ð a a ʃ ɛ z ɒ v ð a f aj a SP,0.71 0.04 0.22 0.11 0.33 0.05 0.26 0.12 0.04 0.05 0.2 0.11 0.07 0.1 0.11 0.33 0.03 0.03 0.03 0.03 0.03 1.12 0.08 0.25 0.05 0.04 0.11 0.16 1.35 0.14 0.44,1 2 3 6 5 2 4 2 2 3 1,rest A#2 A3 B3 B3 B3 A3 A3 G#3 G#3 A3 G#3 A3 B3 G#3 rest,0.603719 0.476009 0.17415 0.22059 0.429569 0.406349 0.22059 0.383129 0.18576 0.452789 0.394739 0.278639 0.313469 0.278639 1.439637 0.487619,
